{
  "protocolVersion": "0.1",
  "messageId": "msg_permission_request_001",
  "correlationId": "msg_job_create_001",
  "sentAt": "2026-07-23T00:58:00.000Z",
  "source": {
    "kind": "companion",
    "deviceId": "desktop_liao_pc"
  },
  "target": {
    "kind": "phone",
    "deviceId": "phone_lanxing_001"
  },
  "type": "permission.request",
  "payload": {
    "permissionRequestId": "perm_req_001",
    "jobId": "job_fix_code_001",
    "affairId": "affair_fix_code_001",
    "requestedPermissions": ["workspace.write"],
    "reason": "当前 job 需要修复测试失败并写入项目文件",
    "risk": "medium",
    "proposedScope": {
      "workspaceRoot": "F:/workspace/xxx",
      "commands": [],
      "networkHosts": []
    }
  }
}
