{
  "protocolVersion": "0.1",
  "messageId": "msg_job_progress_001",
  "correlationId": "msg_job_create_001",
  "sentAt": "2026-07-23T00:59:00.000Z",
  "source": {
    "kind": "companion",
    "deviceId": "desktop_liao_pc"
  },
  "target": {
    "kind": "phone",
    "deviceId": "phone_lanxing_001"
  },
  "type": "job.progress",
  "payload": {
    "jobId": "job_fix_code_001",
    "affairId": "affair_fix_code_001",
    "executor": "openclaw",
    "status": "running",
    "goal": "Inspect and fix the selected project until tests pass.",
    "workspaceHint": "F:/workspace/xxx",
    "allowedPermissions": ["workspace.read", "command.run"],
    "progressSummary": "已定位失败用例，正在尝试修复",
    "recentSteps": [
      {
        "at": "2026-07-23T00:58:40.000Z",
        "kind": "tool",
        "text": "command.run: 定位失败用例"
      }
    ],
    "resultDigest": null,
    "evidenceQuality": "weak",
    "blockedReason": null,
    "resumeCondition": null,
    "permissionRequestId": null
  }
}
